{
  "schemaVersion": "historian-publication-v1",
  "publicationId": "11111111-1111-4111-8111-111111111111",
  "sourceSequence": 1,
  "publishedAt": "2026-08-01T00:00:00Z",
  "payloadHash": "0123456789abcdef0123456789abcdef0123456789abcdef0123456789abcdef",
  "compartmentCount": 2,
  "segmentCount": 3,
  "evidenceCount": 4,
  "summary": "Deterministic publication fixture"
}
